tt1196338,Pound of Flesh,Movie,Drama,2010,,NO DATA,"['tt1196338', 'Malcolm McDowell', 'Ashley Wren Collins', 'Timothy Bottoms', 'Whitney Able', 'Lilly McDowell', 'Taryn Southern', 'Angus Macfadyen', 'Robert Harvey', 'Eric Chaikin', 'Elizabeth Rodriguez']",[],"Based on true events: Noah Melville (Malcolm McDowell), a popular college professor and confirmed sensualist, provides scholarships for gorgeous college girls through an escort service, whose satisfied clients include the chairman of the school board (Timothy Bottoms), the chief of police, and even the Mayor of their idyllic college town.",NO DATA
tt1196682,Quit,Movie,Drama,2010,4.0,NO DATA,"['tt1196682', 'Noah Segan', 'Diora Baird', 'Nathan Phillips', 'Don Swayze', 'Stephen Heath', 'Chloe Webb', 'Sasha Grey', 'Lauri Johnson', 'Lee Arenberg', 'Gloria LeRoy']",[],"Una pareja se dirige a una cabaña en Joshua Tree durante cuatro días para dejar de fumar. A medida que comienza su abstinencia de nicotina, se encuentran en desacuerdo con quienes son y en quienes quieren convertirse.",87
tt1198133,Lapse,Movie,Drama,2010,8.0,NO DATA,"['tt1198133', 'Karolina Dryzner', 'Sirry Jons', 'Keith Roenke', 'Emmett J Scanlan']",[],A woman wakes up one morning alone in the desert with no memory and blood on her hands. Reality and memory collide as she struggles to make sense of events.,75
tt1198101,Kites,Movie,Drama,2010,5.0,NO DATA,"['tt1198101', 'Hrithik Roshan', 'Bárbara Mori', 'Nicholas Brown', 'Kangana Ranaut', 'Kabir Bedi', 'Madhuri Bhatia', 'Anand Tiwari', 'Yuri Suri', 'Steven Michael Quezada', 'Bob Brahmbhatt']",[],"A wounded man searches for his sweetheart in the Mexican desert while on the run from the police, bounty hunters, and others.",Formato min incorrecto
tt1199552,Dog Jack,Movie,Drama,2010,8.0,NO DATA,"['tt1199552', 'Louis Gossett Jr.', 'Benjamin Gardner', 'Frank Kasy', 'Kenneth Craig', 'Eddie Huchro', 'Kevin Holmen', 'Joe Gandurski', 'Stephen Schuch', 'Shane Kenyon', 'Gregory Winston']",[],"In the midst of the Civil War, a boy and his dog escape a plantation and embark on a life-changing journey. Inspired by true events, ""Dog Jack"" chronicles a turbulent moment in American history, and a tale that's never been forgotten.",Formato min incorrecto
tt1200274,One Too Many Mornings,Movie,Drama,2010,1.0,NO DATA,"['tt1200274', 'Stephen Hale', 'Anthony Deptula', 'Tina Kapousis', 'Jonathan Shockley', 'Jeanette Baity', 'Bruce Burton', 'Daniel Casey', 'Kayleigh Duffy', 'Edward Flores', 'Vincent Foster']",[],A coming of age comedy about two guys who are way too old to be coming of age.,Formato min incorrecto
tt1202513,Assalto ao Santa Maria,Movie,Drama,2010,9.0,NO DATA,"['tt1202513', 'Carlos Paulo', 'Pedro Cunha', 'Leonor Seixas', 'Alfonso Agra', 'Miguel Borines', 'Vítor Norte', 'Bruno Simões', 'João Maria Pinto', 'António Pedro Cerdeira', ""Maria d'Aires""]",[],,104
tt1206314,Lucky Life,Movie,Drama,2013,4.0,NO DATA,"['tt1206314', ""Daniel O'Keefe"", 'Megan McKenna', 'Kenyon Adams', 'Richard Harvell', 'Yohei Kawamata', 'Nancy Huse', 'Stephanie Skaff', 'Nancia Patterson', 'Kyoko Shakagori', 'Samuel Gray Anderson']",[],"A group of friends travels to the beach to encourage Jason, recently diagnosed with terminal cancer. Some time later, as Mark and Karen plan to have a child, the beach trip lingers as a haunting memory in their new phase of life.",104
tt1207009,Next Time Ned,Movie,Drama,2010,5.0,NO DATA,"['tt1207009', 'Raymond Mearns', 'Scott Campbell', 'Adrianne Boyd', 'Lynn Mulvenna', 'Sean Boyle', 'Laura Pearson-Smith', 'Vivien Taylor', 'Kevin McIntyre', 'Ian Barrie', 'Elizabeth Hayley Carson']",[],"For almost thirty years Ned Randall has been trying to make it as an Actor, now in his forties his biggest claim to fame is playing a corpse in Taggart. Always believing that his big break is just around the corner he is affectionately referred to as Next Time Ned by his friends, family and the local community. However 'lady luck' may be on Ned's side as a documentary... Leer todo",76
tt1208716,Person of Interest,Movie,Drama,2010,10.0,NO DATA,"['tt1208716', 'J. Reuben Appelman', 'Nova Tydings', 'Stitch Marker', 'Nick Corbin', 'Antonio Matthew Gutierrez', 'Jaime Irizarry', 'Jim Lile', 'Luke Massengill', 'Andrew Monnier', 'Clayton Parenti']",[],An Iraq War veteran suffering from PTSD becomes convinced that the federal government is setting him up as the fall-guy in a soon-to-be domestic terrorist attack.,72
tt12095436,Mbaku,Movie,Drama,2010,,NO DATA,"['tt12095436', 'Solange Caetano Feijó', 'Helder Martins', 'Manuel Teixeira']",[],,92
tt1210029,Autopilot,Movie,Drama,2010,,NO DATA,"['tt1210029', 'Nathan Patrick Agin', 'Jay Bodnar', 'Jaye Bodnar', 'Drew Boronkay', 'Habi Boronkay', 'Riley Boronkay', 'Sofia Boronkay', 'David Burden', 'Eileen Ceballos', 'Melissa Culverwell']",[],The haunting story of a man released from a mental institution 16 years after accidentally being responsible for the death of his mother.,Formato min incorrecto
tt1210039,Blood Done Sign My Name,Movie,Drama,2010,2.0,NO DATA,"['tt1210039', 'Emily Alyn Lind', 'Natalie Alyn Lind', 'Michael Rooker', 'Nick Searcy', 'Ricky Schroder', 'Susan Walters', 'Lee Norris', 'Darrin Dewitt Henson', 'Omar Benson Miller', 'Mike Pniewski']",[],"Un veterano negro de la era de Vietnam es asesinado por un hombre de negocios blanco local, que más tarde es exonerado. La trama se centra en un profesor de instituto local y en los disturbios civiles que siguieron a la absolución.",NO DATA
tt1210059,Flying Lessons,Movie,Drama,2010,2.0,NO DATA,"['tt1210059', 'Maggie Grace', 'Christine Lahti', 'Hal Holbrook', 'Cary Elwes', 'Jonathan Tucker', ""Michael O'Neill"", 'Joanna Cassidy', 'Rick Gonzalez', 'Nikki Deloach', 'Maggie Castle']",[],"With her life at a crossroads, 25 year old Sophie Conway returns home to the small town she always wanted to forget. Once home, she is faced with the friends and lovers she left behind, a tangled relationship with her Mother, and Harry Pleasant, an Alzheimer's Disease patient who, in an opposing way, shares Sophie's struggle to remember.",NO DATA
tt1212434,One Wish,Movie,Drama,2010,11.0,NO DATA,"['tt1212434', 'Bella Thorne', 'Kevin Kilner', 'Christa B. Allen', 'Symba', 'Kelsey Nicole Weber', 'Jasmine Lowe', 'Ali Fussell', 'Colleen Irene Boag', 'Albert Malafronte', 'Deprise Brescia']",[],"A father is preparing himself for his daughters dance competition, sees a little girl about to get run over by a car so he saves her, for his good dead he is visited by The messenger and she gives him one wish.",104
tt12126806,Pokuda budet veter...,Movie,Drama,2010,11.0,NO DATA,"['tt12126806', 'Sergey Balanov', 'Aleksei Makarov', 'Lena Maksimova', 'Nyurgustaan Mandarov', 'Ivan Novikov']",[],,80
tt1212419,Hereafter,Movie,Drama,2011,3.0,NO DATA,"['tt1212419', 'Matt Damon', 'Cécile de France', 'Bryce Dallas Howard', 'Thierry Neuvic', 'Cyndi Mayo', 'Lisa Griffiths', 'Jessica Griffiths', 'Ferguson Reid', 'Derek Sakakura', 'Jay Mohr']",[],"Tres personas, un obrero estadounidense, una periodista francesa y un colegial londinense, se ven afectadas por la muerte de diferentes maneras.",NO DATA
tt1212453,Odoru daisousasen the movie 3: Yatsura o kaihou seyo!,Movie,Drama,2010,7.0,NO DATA,"['tt1212453', 'Yûji Oda', 'Eri Fukatsu', 'Yûsuke Santamaria', 'Atsushi Itô', 'Yuki Uchida', 'Kôtarô Koizumi', 'Sôichirô Kitamura', 'Takehiko Ono', 'Satoru Saitô', 'Kenta Satoi']",[],It's business as usual for detective Aoshima as he tries to solve three peculiar crime cases at the same time in this third feature length episode of popular Japanese drama.,141
tt1212454,An Invisible Sign,Movie,Drama,2011,4.0,NO DATA,"['tt1212454', 'Jessica Alba', 'Chris Messina', 'Sonia Braga', 'John Shea', 'J.K. Simmons', 'Sophie Nyweide', 'Bailee Madison', 'Marylouise Burke', 'Ashlie Atkinson', 'Crystal Bock']",[],"Mona Gray es una solitaria de 20 años que, de niña, recurrió a las matemáticas para salvarse después de que su padre se enfermara. Ahora enseña la asignatura y debe ayudar a sus alumnos a superar sus propias crisis.",NO DATA
tt1213590,Mercy,Movie,Drama,2010,6.0,NO DATA,"['tt1213590', 'Emily Tremaine Fernandez', 'Thomas R. Baker', 'Shana Dowdeswell', 'Arnold Chun', 'Heidi Kristoffer', 'Kevin Henderson', 'Heather Pence', 'Steve Beauchamp', 'April Rawlings', 'Rick Pantera']",[],A buddy-action account in the underworld of New Orleans.,NO DATA
tt1213648,London Boulevard,Movie,Drama,2011,2.0,NO DATA,"['tt1213648', 'Colin Farrell', 'Keira Knightley', 'Ray Winstone', 'David Thewlis', 'Anna Friel', 'Ben Chaplin', 'Eddie Marsan', 'Sanjeev Bhaskar', 'Stephen Graham', 'Ophelia Lovibond']",[],"Un expresidiario con cierta reputación intenta reformarse, trabajando como encargado del mantenimiento de una solitaria actriz, pero un cabecilla del crimen organizado londinense no está del todo de acuerdo con su decisión.",NO DATA
tt1214981,SP: The motion picture yabô hen,Movie,Drama,2010,10.0,NO DATA,"['tt1214981', 'Yôko Maki', ""Jun'ichi Okada"", ""Shin'ichi Tsutsumi"", 'Teruyuki Kagawa', 'Satoru Matsuo', 'Akihiko Sai', 'Yukijirô Hotaru', 'Tomomi Maruyama', 'Fuyuhiko Nishi', 'Kei Yamamoto']",[],"When Kaoru Inoue (Junichi Okada) opposes Soichiro Ogata (Shin'ichi Tsutsumi), Soichiro makes the cryptic remark ""It couldn't be helped. It was for a greater cause ..."" One month later, at an event hall in Roppongi Hills, there is a charity event for landmine eradication. Kaoru does security with Security Police officers Soichiro Ogata, Eri Sasamoto (Yoko Maki), Takah... Leer todo",98
tt12153448,Lucy Island,Movie,Drama,2010,,NO DATA,"['tt12153448', 'Tony Bell', 'Esther Coles', 'Joe Dempsie', 'Sophie Ellerby', 'Georgia Groome']",[],,45
tt1216520,Womb,Movie,Drama,2011,4.0,NO DATA,"['tt1216520', 'Eva Green', 'Matt Smith', 'Lesley Manville', 'Peter Wight', 'István Lénárt', 'Hannah Murray', 'Ruby O. Fee', 'Tristan Christopher', 'Jesse Hoffmann', 'Natalia Tena']",[],"El amor devorador de una mujer la obliga a tener el clon de su amado muerto. Desde su infancia hasta la edad adulta, se enfrenta a las inevitables complejidades de su controvertida decisión.",Formato min incorrecto
tt12171216,Dou Khahar,Movie,Drama,2010,9.0,NO DATA,"['tt12171216', 'Mohammad Reza Golzar', 'Hamed Komaily', 'Elnaz Shakerdoost', 'Niki Karimi', 'Behnoosh Bakhtiari', 'Arzhang Amirfazli', 'Hushang Harirchiyan', 'Pourandokht Mahiman', 'Soheil Saeedi']",[],,105
tt12180606,Las aventuras de Beto y Roberto,Movie,Drama,2010,3.0,NO DATA,['tt12180606'],[],,NO DATA
tt1219342,Legend of the Guardians: The Owls of Ga'Hoole,Movie,Drama,2010,9.0,NO DATA,"['tt1219342', 'Jim Sturgess', 'Hugo Weaving', 'David Wenham', 'Emily Barclay', 'Abbie Cornish', 'Essie Davis', 'Adrienne DeFaria', 'Joel Edgerton', 'Deborra-Lee Furness', 'Sacha Horler']",[],"Cuando un joven búho es secuestrado por un ejército de búhos malvados, debe escapar con nuevos amigos y buscar a los legendarios Guardianes para detener la amenaza.",NO DATA
tt1220888,Henry's Crime,Movie,Drama,2011,4.0,NO DATA,"['tt1220888', 'Keanu Reeves', 'Vera Farmiga', 'James Caan', 'Judy Greer', 'Fisher Stevens', 'Danny Hoch', 'Bill Duke', 'Drew McVety', 'Tim Snay', 'Carlos Pizarro']",[],"Released from prison for a crime he didn't commit, an ex-con targets the same bank he was sent away for robbing.",NO DATA
tt1220625,Cupid's Arrow,Movie,Drama,2010,,NO DATA,"['tt1220625', 'C. Thomas Howell', 'Chandler Rylko', 'Najarra Townsend', 'Cassidy Gard', 'Benjamin Seay', 'Jeremy Radin', 'Aris Alvarado', 'Joel Harold', 'Joseph Harold', 'Parker Young']",[],"An innocent college couple unknowingly become involved in their Professor's illicit research into the manipulation of love and his recreation of the elusive ""Cupid's Arrow"".",NO DATA
tt1221208,Frankie & Alice,Movie,Drama,2014,8.0,NO DATA,"['tt1221208', 'Halle Berry', 'Stellan Skarsgård', 'Phylicia Rashad', 'Chandra Wilson', 'Alex Diakun', 'Joanne Baron', 'Brian Markinson', 'Matt Frewer', 'Rosalyn Coleman', 'Sean Tyson']",[],A drama centered on a go-go dancer with multiple personality disorder who struggles to remain her true self and begins working with a psychotherapist to uncover the mystery of the inner ghosts that haunt her.,NO DATA
tt1222698,Beneath the Blue,Movie,Drama,2010,,NO DATA,"['tt1222698', 'Caitlin Wachs', 'Samantha Jade', 'George Harris', 'Paul Wesley', 'Ivana Milicevic', 'Leah Eneas', 'David Keith', 'Christine Adams', 'Eva-Jean Sophia Young', 'Bella King']",[],Dolphin experts confront the US Navy when its sonar program is suspected of causing the animals' deaths.,NO DATA
tt1224136,The Tested,Movie,Drama,2012,,NO DATA,"['tt1224136', 'Aunjanue Ellis-Taylor', 'Armando Riesco', 'Michael Morris Jr.', 'Frank Vincent', 'Annie Parisse', 'Nathan Corbett', 'Tobias Truvillion', 'Kristen Dowtin', 'Al Thompson', 'Antonio Edwards Suarez']",[],A life shattering tragedy sends three people on vastly different paths to a similar goal of redemption and understanding.,Formato min incorrecto
tt12246482,The Will,Movie,Drama,2010,1.0,NO DATA,"['tt12246482', 'Johnny Chen', 'Brian Chou', 'Rebecca Lim', 'Crystal Lin']",[],,90
tt1225703,No Greater Love,Movie,Drama,2010,5.0,NO DATA,"['tt1225703', 'Anthony Tyler Quinn', 'Danielle Bisutti', 'Jay Underwood', 'Seth Axen', 'Eric Bivens-Bush', 'Michelle DeLynn', 'Travis Herche', 'Lynn Howerton', 'Dallas Johnson', 'Christine Mawhorter']",[],"Jeff and Heather Baker were life long sweethearts and happily married... for a time. But at her greatest moment of weakness, Heather abandons Jeff, forcing Jeff to raise their young son alone. Ten years later, through a God ordained encounter, Jeff and Heather meet again. They must wrestle with forgiveness, reconciliation and the pressing of the Savior on their hearts... Leer todo",90
tt1226273,Edge of Darkness,Movie,Drama,2010,1.0,NO DATA,"['tt1226273', 'Mel Gibson', 'Ray Winstone', 'Danny Huston', 'Bojana Novakovic', 'Shawn Roberts', 'David Aaron Baker', 'Jay O. Sanders', ""Denis O'Hare"", 'Damian Young', 'Caterina Scorsone']",[],"El detective de homicidios Thomas Craven investiga la muerte de su hija, una activista, y descubre secretos oscuros y los esfuerzos corporativos por encubrirlos.",NO DATA
tt1226737,Alphonso Bow,Movie,Drama,2010,2.0,NO DATA,"['tt1226737', 'Jeffrey Pierce', 'Michael Dempsey', 'Kate Rodger', 'Kasey Buckley', 'Joan Marlowe', 'Eddie Ruiz', 'Lindsay Seim']",[],"A brick salesman and an ex male-exotic-dancer trained in the martial arts argue on sex, religion, life on other planets, Hitler, Samuel Beckett, a severely injured dog, and early childhood behavior in a family style Mexican restaurant in the South.",Formato min incorrecto
tt1226753,The Debt,Movie,Drama,2011,9.0,NO DATA,"['tt1226753', 'Helen Mirren', 'Sam Worthington', 'Tom Wilkinson', 'Jessica Chastain', 'Ciarán Hinds', 'Romi Aboulafia', 'Tomer Ben David', 'Ohev Ben David', 'Jonathan Uziel', 'Elana Kivity Davenport']",[],"En 1965, tres agentes del Mossad cruzan a Berlín Oriental para detener a un famoso criminal de guerra nazi. Treinta años después, los secretos que comparten los agentes vuelven a perseguirlos.",NO DATA
tt1227524,Aashayein,Movie,Drama,2010,8.0,NO DATA,"['tt1227524', 'John Abraham', 'Anaitha Nair', 'Girish Karnad', 'Farida Jalal', 'Prateeksha Lonkar', 'Ashwin Chitale', 'Sonal Sehgal', 'Vipin Bhali', 'Poonam Chitale', 'Arjun Dhanraj']",[],A man meets with assorted characters in a nursing home after being diagnosed with cancer.,Formato min incorrecto
tt12282568,Around Hell,Movie,Drama,2010,10.0,NO DATA,"['tt12282568', 'Koppány Bene', 'Attila Bereczki', 'Dániel Vazul Csige', 'Sándor Csikós', 'Anna Czeglédi', 'Eszter Deli', 'Evelin Dobos', 'Anikó Eperjes', 'László Fehér', 'Petra Guthy']",[],,80
tt1228987,Let Me In,Movie,Drama,2011,1.0,NO DATA,"['tt1228987', 'Kodi Smit-McPhee', 'Chloë Grace Moretz', 'Richard Jenkins', 'Cara Buono', 'Elias Koteas', 'Sasha Barrese', 'Dylan Kenin', 'Chris Browning', 'Ritchie Coster', 'Dylan Minnette']",[],Un joven acosado entabla amistad con una joven vampira que vive en secreto con su guardián.,NO DATA
tt1229381,Hors la loi,Movie,Drama,2010,9.0,NO DATA,"['tt1229381', 'Jamel Debbouze', 'Roschdy Zem', 'Sami Bouajila', 'Chafia Boudraa', 'Bernard Blancan', 'Sabrina Seyvecou', 'Assaad Bouab', 'Thibault de Montalembert', 'Samir Guesmi', 'Jean-Pierre Lorit']",[],Un drama sobre la lucha argelina por la independencia de Francia después de la II Guerra Mundial.,NO DATA
tt1230196,Puss,Movie,Drama,2010,8.0,NO DATA,"['tt1230196', 'Alexander Skarsgård', 'Gustaf Skarsgård', 'Filip Berg', 'Moa Gammel', 'Vera Vitali', 'Victor von Schirach', 'Susanne Thorson', 'Gitte Witt', 'Michael Segerström', 'Richard Ulfsäter']",[],A comical fresco on human misdemeanors and betrayals... A film about our right to not be perfect.,105
tt1230385,Hwanghae,Movie,Drama,2010,12.0,NO DATA,"['tt1230385', 'Lee Yoo-mi', 'Ha Jung-woo', 'Kim Yoon-seok', 'Seo-hyun Ahn', 'Byeong-eun Park', 'Lee Hee-joon', 'Jo Sung-ha', 'Cheol-min Lee', 'Man-sik Jeong', 'Hwang Seok-jeong']",[],"Cuando el intento de matar a un profesor sale mal, se desencadenan una serie de eventos violentos que obligan al taxista a correr por su vida.",NO DATA
tt1230478,Yohan - Barnevandrer,Movie,Drama,2010,3.0,NO DATA,"['tt1230478', 'Robin Pedersen Daniel', 'Kris Kristofferson', 'Mathilde Berg', 'Dennis Storhøi', 'Agnete G. Haaland', 'Adam Eftevaag', 'Jørgen Langhelle', 'Alexander Rybak', 'Kari Kleiv', 'Tom Wilson']",[],"With his family struggling to survive in late-1890s Norway and his father leaving on a ship for America to earn much-needed money, 10-year-old Yohan devises his own plans to help his family, but his jealous older brother has other ideas and, unbeknownst to their parents, he signs a contract with an agent for Yohan to become a farm laborer. Now consigned to being a chi... Leer todo",125
tt1231583,Due Date,Movie,Drama,2010,11.0,NO DATA,"['tt1231583', 'Robert Downey Jr.', 'Zach Galifianakis', 'Michelle Monaghan', 'Jamie Foxx', 'Juliette Lewis', 'Danny McBride', 'RZA', 'Matt Walsh', 'Brody Stevens', 'Jakob Ulrich']",[],"Peter Highman espera su primer hijo, y tiene que aceptar un viaje en coche con el aspirante a actor Ethan Tremblay para llegar a tiempo al nacimiento.",NO DATA
tt1232838,Triple Dog,Movie,Drama,2010,9.0,NO DATA,"['tt1232838', 'Britt Robertson', 'Alexia Fast', 'Scout Taylor-Compton', 'Janel Parrish', 'Emily Tennant', 'Carly McKillip', 'Aubrey Mozino', 'Brett Davern', 'Jeffrey Ballard', 'Richard Harmon']",[],"On the night of a sleepover, a group of teenage girls venture out in a competitive game of challenging dares. As the antics escalate, and the dares become more extreme, the girls unravel the truth behind a former student's rumored suicide.",NO DATA
tt1233192,Brighton Rock,Movie,Drama,2011,2.0,NO DATA,"['tt1233192', 'Sam Riley', 'Andrea Riseborough', 'Helen Mirren', 'John Hurt', 'Phil Davis', 'Nonso Anozie', 'Craig Parkinson', 'Andy Serkis', 'Sean Harris', 'Geoff Bell']",[],"Charts the headlong fall of Pinkie, a razor-wielding disadvantaged teenager with a religious death wish.",NO DATA
tt1233290,Hanni & Nanni,Movie,Drama,2011,8.0,NO DATA,"['tt1233290', 'Sophia Münster', 'Jana Münster', 'Hannelore Elsner', 'Heino Ferch', 'Suzanne von Borsody', 'Anja Kling', 'Katharina Thalbach', 'Oliver Pocher', 'Zoe Thurau', 'Aleen Jana Kötter']",[],A drama centered around twins attending the same boarding school.,85
tt1234559,Chico Xavier,Movie,Drama,2010,4.0,NO DATA,"['tt1234559', 'Natalia Soutto', 'Nelson Xavier', 'Ângelo Antônio', 'Matheus Costa', 'Tony Ramos', 'Christiane Torloni', 'Giulia Gam', 'Letícia Sabatella', 'Luís Melo', 'Pedro Paulo Rangel']",[],A biography of spiritual medium and author Francisco Candido Xavier.,124
tt1234546,'Master Harold' ... And the Boys,Movie,Drama,2010,3.0,NO DATA,"['tt1234546', 'Ving Rhames', 'Freddie Highmore', 'Patrick Mofokeng', 'Jennifer Steyn', 'Michael Maxwell', 'Redd Valentino', 'Zoliswa Kawe', 'Bongo Mbutuma', 'Nceba Mpiliswana', 'Vuyisile Pandle']",[],"Hally, a white South African adolescent, is stuck between his intolerant father's view of him and those of his caregiver, Sam, a Black waiter who is Hally's friend and teacher. Hally is required to laugh at his father's racist jokes; Sam exposes Hally is uplifting experiences. Hally has a memory of being terribly humiliated by his father; Sam shows Hally how to be pro... Leer todo",NO DATA
tt1234654,Greenberg,Movie,Drama,2010,7.0,NO DATA,"['tt1234654', 'Ben Stiller', 'Greta Gerwig', 'Jennifer Jason Leigh', 'Rhys Ifans', 'Koby Rouviere', 'Sydney Rouviere', 'Chris Messina', 'Susan Traylor', 'Merritt Wever', 'Emily Lacy']",[],"Un hombre de Los Ángeles, mudado a Nueva York hace años, regresa a Los Ángeles para redescubrir su vida mientras cuida a su hermano. Pronto descubre la química entre él y la asistente de su hermano.",NO DATA
tt1234540,De vliegenierster van Kazbek,Movie,Drama,2010,4.0,NO DATA,"['tt1234540', 'Anamaria Marinca', 'Sallie Harmsen', 'Jack Wouterse', 'Peter Lohmeyer', 'Rick Paul van Mulligen', 'Dick van den Toorn', 'Madelief Blanken', 'Kakha Kintsurashvili', 'Mea Dols de Jong', 'Sylvia Poorta']",[],"On the island Texel, Marie dreams about mountains; she collects postcards of mountains all over the world. She would love to do something else with her life, but as the only girls in a big poor family in wartime, Marie has no choice: she must marry Paul. The extreme religious and narrow minded population at the island expects her to behave. The arrival of a group of G... Leer todo",104
tt1235537,Mahler auf der Couch,Movie,Drama,2010,7.0,NO DATA,"['tt1235537', 'Johannes Silberschneider', 'Barbara Romaner', 'Karl Markovics', 'Eva Mattes', 'Friedrich Mücke', 'Lena Stolze', 'Nina Berten', 'Karl Fischer', 'Matthias Franz Stein', 'Max Mayer']",[],Alma Mahler's affair with the young architect Walter Gropius sets in motion a marital drama that forces her husband Gustav Mahler to seek advice from Sigmund Freud.,98
tt1235548,VIPs,Movie,Drama,2011,3.0,NO DATA,"['tt1235548', 'Wagner Moura', 'Gisele Fróes', 'Emiliano Ruschel', 'Marcela Falci', 'Heitor Goldflus', 'Cecília Homem de Mello', 'Roger Gobeth', 'Amaury Jr.', 'João Francisco Tottene', 'Norival Rizzo']",[],The life of a real conman and one of the biggest frauds in Brazil.,Formato min incorrecto
tt1235830,Chico & Rita,Movie,Drama,2010,11.0,NO DATA,"['tt1235830', 'Eman Xor Oña', 'Limara Meneses', 'Mario Guerra', 'Jon Adams', 'Renny Arozarena', 'Blanca Rosa Blanco', 'Jackie de la Nuez', 'Rigoberto Ferrera', 'Ken Forman', 'Ray Gillon']",[],"Chico es un pianista joven con grandes sueños. Rita es una hermosa cantante con una extraordinaria voz. La música y el deseo romántico los unen, pero su viaje, en la tradición de la balada latina, trae dolor y tormento.",Formato min incorrecto
tt1235853,Contre toi,Movie,Drama,2011,4.0,NO DATA,"['tt1235853', 'Kristin Scott Thomas', 'Pio Marmaï', 'Jean-Philippe Écoffey', 'Marie-Sohna Condé', 'Marie-Christine Orry', 'Vinciane Millereau', 'Sophie Fougère', 'Jean-Louis Tribes', 'Laurent Cyr', 'Olivier Galliano']",[],"An act of revenge takes an unexpected turn in this psychological drama from French Writer and Director Lola Doillon. Anna (Dame Kristin Scott Thomas) flees a house on the outskirts of Paris and returns home, careful to tell no one where she's been or what she's been doing. The next day, after an ordinary day of work as an OB-GYN, Anna stops at a Police station and rep... Leer todo",NO DATA
tt1236250,Gigola,Movie,Drama,2011,1.0,NO DATA,"['tt1236250', 'Lou Doillon', 'Eduardo Noriega', 'Marie Kremer', 'Rossy de Palma', 'Ana Padrão', 'Virginie Pradal', 'Arly Jover', 'Marisa Berenson', 'Marisa Paredes', 'Thierry Lhermitte']",[],"Ambientada en el mundo atrevido del París de los 60, Gigola es una joven ingeniosa y deseable que explora el inframundo lésbico de la ciudad que pronto se convierte en una escort de alto precio.",Formato min incorrecto
tt1236371,Mistérios de Lisboa,Movie,Drama,2011,5.0,NO DATA,"['tt1236371', 'Adriano Luz', 'Maria João Bastos', 'Ricardo Pereira', 'João Arrais', 'Vânia Rodrigues', 'Joana de Verona', 'Rui Morisson', 'João Villas-Boas', 'Maria João Pinho', 'Clotilde Hesme']",[],"Follows a jealous countess, a wealthy businessman, and a young orphaned boy across Portugal, France, Italy and Brazil where they connect with a variety of mysterious individuals.",NO DATA
tt1238300,Revision - Apocalypse II,Movie,Drama,2010,9.0,NO DATA,"['tt1238300', 'Eva Dorrepaal', 'Clayton Nemrow', 'Jacob Dove Basker', 'Sebastian Suba', 'Heike-Melba Fendel', 'Alan Smith', 'Jacqueline Blouin', 'Simon Werner', 'Tomas Spencer', 'Natascha Bonnermann']",[],,80
tt1239290,Kvinden der drømte om en mand,Movie,Drama,2010,1.0,NO DATA,"['tt1239290', 'Sonja Richter', 'Marcin Dorocinski', 'Michael Nyqvist', 'Alberte Blichfeldt', 'Tammi Øst', 'Sara Hjort Ditlevsen', 'Janusz Francisziek Komodowski', 'Franck Monsigny', 'Monika Krzywkowska', 'Olga Boladz']",[],What happens when a sexual connection overwhelms all your senses? A woman puts everything on the line in pursuit of a passionate affair with a man she hardly knows.,100
tt1239216,The Assignment,Movie,Drama,2011,,NO DATA,"['tt1239216', 'Adam Baldwin', 'Linsey Godfrey', 'Jake Thomas', 'French Stewart', 'M. Emmet Walsh', 'Andrew St. John', 'George Newbern', 'Robert Culp', 'Yassmin Alers', 'Joy Jorgensen']",[],"After acceptance to a prestigious music school, Eliza's world is rocked when she discovers a shocking mystery about her family.",NO DATA
tt1239430,La cité,Movie,Drama,2010,2.0,NO DATA,"['tt1239430', 'Jean-Marc Barr', 'Claude Legault', 'Pierre Lebeau', 'Vincent Winterhalter', 'Sabine Karsenti', 'François Nadin', 'Lotfi Abdelli', 'Arbi Bibi', 'Lotfi Dziri', 'Abdelwaheb Jemli']",[],"A doctor broken by 8 years of war in North Africa tries to come back home. On his way, he is faced with a bigger challenge: save a city from the plague... And from madness.",82
