tt1388794,Sin ella,Movie,Drama,2010,11.0,NO DATA,"['tt1388794', 'Luis Roberto Guzmán', 'Lola Dueñas', 'Zuria Vega', 'Paola Núñez', 'Francisco Gattorno', 'Fernando Ciangherotti', 'Luis Arrieta', 'Alan Sánchez', 'Gael Sánchez', 'Rocío Verdejo']",[],"Jorge Colon's SIN ELLA shows us how much a family member can guide the values and lives of the others, even when absent. Set in present-day Mexico City, the story follows Gastón (Luis Roberto Guzmán, in a striking performance different from his action-man TV roles), a successful TV producer who has to learn how to be a good dad for his teenage daughter and younger son... Leer todo",109
tt1388776,Poursuite,Movie,Drama,2011,3.0,NO DATA,"['tt1388776', 'Marina Deak', 'Yann Guillemot', 'Renaud Dehesdin', 'Paul Cahen', 'Agnès Château', 'Aurélien Recoing', 'Delphine Chuillot', 'Agathe Dronne', 'Astrid Adverbe', 'Alexia Rhodier']",[],"Audrey has left Eric. But there's still Paul, their five year-old son: Audrey leaves him with her mum ""just for the time being"". But for how long? Until she finds somewhere to live, a new job, a stable companion?",Formato min incorrecto
tt1390540,The Penny,Movie,Drama,2010,10.0,NO DATA,"['tt1390540', 'Tom Lodewyck', 'Brian Morvant', 'Kyle Walters', 'Molly Kunz', 'Dan Bell', 'Amy Levenhagen', 'Tiersa Ferraro', 'Zack Newman', 'Evan Newman', 'Rachael Lau']",[],"""The Penny"" is a drama/thriller that follows a series of seemingly insignificant events in a number of people's lives. Hidden amidst their ""bigger"" problems, these disconnected pieces of their lives go unnoticed until they begin to fit together in a totally unexpected way. Suddenly these strangers are thrust together by what some would call luck, chance, fate, coincid... Leer todo",88
tt1390535,The Final,Movie,Drama,2013,2.0,NO DATA,"['tt1390535', 'Marc Donato', 'Jascha Washington', 'Whitney Hoy', 'Justin Arnold', 'Lindsay Seidel', 'Julin', 'Laura Ashley Samuels', 'Travis Tedford', 'Eric Isenhower', 'Vincent Silochan']",[],An awkward student with a deadly vendetta leads a group of outcasts who plot to avenge the years of humiliation they faced by the popular students at Hohn High School.,NO DATA
tt1390533,Bedrooms,Movie,Drama,2010,8.0,NO DATA,"['tt1390533', 'Jordan Belfi', 'Moon Bloodgood', 'Julie Benz', 'Jesse Garcia', 'Dee Wallace', 'Barry Bostwick', 'Sarah Clarke', 'Ellery Sprayberry', 'Dylan Sprayberry', 'Xander Berkeley']",[],"Bedrooms tells a story about the walls that separate people, the heartbreak and infidelity that's often the result and the redemption that comes from tearing those walls down. The film is told in 4 stories by 3 filmmakers. Three of the stories deal with married couples of various ages confronting the turning points of their relationships. A fourth story is interwoven ... Leer todo",85
tt1390397,Baseline,Movie,Drama,2012,8.0,NO DATA,"['tt1390397', 'Jamie Foreman', 'Dexter Fletcher', 'Zoë Tapper', 'Gary Stretch', 'Gordon Alexander', 'Freddie Connor', 'Brenden Lovett', 'Sheraiah Larcher', 'Kellie Shirley', 'Gemma Atkinson']",[],"The Baseline is the centre of the East London grime club scene and the queue regularly stretches around the block. Danny works on the door - breaking up fights and managing drunk kids. However, when he rescues Terry, the club owner and local gang leader, from a hitman, Danny is suddenly plunged deep into an underworld he had tried so hard to avoid. Danny is promoted t... Leer todo",96
tt1390415,Orly,Movie,Drama,2010,8.0,NO DATA,"['tt1390415', 'Josse De Pauw', 'Maren Eggert', 'Natacha Régnier', 'Bruno Todeschini', 'Mireille Perrier', 'Emile Berling', 'Jirka Zett', 'Lina Falkner', 'Marie Carmen De Zaldo', 'Frédéric Zajderman']",[],"En el impersonal jaleo del aeropuerto de París, desconocidos se encuentran, secretos se comparten, y repentinos espacios de intimidad se crean en este bellamente observado mosaico de vidas en tránsito.",Formato min incorrecto
tt1390542,Tranquility,Movie,Drama,2010,,NO DATA,"['tt1390542', 'Damon Taylor', 'Betsy Roth', 'Luchana Gatica', 'Curtis Buck', 'Mona Lee Goss', 'Ryan Preimesberger', 'Bonnie Burgess-Leigh', 'Nate Geez', 'Tim Aslin', 'Jeff Swarthout']",[],"JIMMY KOVAC is a line cook in a Los Angeles restaurant. Jimmy fights with his boss, drinks beer, watches TV, and occasionally sleeps with MONICA, a supermarket checkout girl. But when he meets KATE, a New York actress in town for pilot season, Jimmy's life changes. Educated and privileged, it seems that Kate would have little interest in Jimmy, but as she spends more ... Leer todo",NO DATA
tt1390840,Walkaway,Movie,Drama,2010,10.0,NO DATA,"['tt1390840', 'Manu Narayan', 'Samrat Chakrabarti', 'Sanjiv Jhaveri', 'Manish Dayal', 'Deepti Gupta', 'Pallavi Sharda', 'Carrie Anne James', 'Ami Sheth', 'Geeta Citygirl Chopra', 'Dani Alvarado']",[],"Four intersecting stories, each exploring different aspects of love and companionship, as four friends struggle to find their way through the meanders of Indian matrimony, in a bittersweet attempt to combine their deep-rooted tradition and 'modern' New York life in perfect harmony.",Formato min incorrecto
tt1391034,And Soon the Darkness,Movie,Drama,2017,3.0,NO DATA,"['tt1391034', 'Amber Heard', 'Odette Annable', 'Karl Urban', 'Adriana Barraza', 'César Vianco', 'Michel Noher', 'Luis Sabatini', 'Daniel Figuereido', 'Jorge Booth', 'Gia Mantegna']",[],"Cuando dos chicas estadounidenses en un viaje en bicicleta en una parte remota de Argentina se separan y una de ellas desaparece, la otra debe encontrarla antes de que sus peores temores se hagan realidad.",NO DATA
tt1391142,Änglavakt,Movie,Drama,2010,3.0,NO DATA,"['tt1391142', 'Michael Nyqvist', 'Izabella Scorupco', 'Tchéky Karyo', 'Jacob Ericksson', 'Ewa Fröling', 'Saga Gärde', 'Melker Duberg', 'Henrik Bauer', 'Kajsa Ernst', 'Peter Jankert']",[],An accident overthrows Ernst and Cecilia's well-ordered life. Chance rules in Ernst's rational world while Cecilia is searching for a deeper meaning in what has happened. As they drift further and further apart a mysterious stranger with exceptional gifts changes their lives in an unexpected way.,NO DATA
tt1391143,Tête de turc,Movie,Drama,2010,3.0,NO DATA,"['tt1391143', 'Roschdy Zem', 'Pascal Elbé', 'Ronit Elkabetz', 'Samir Makhlouf', 'Simon Abkarian', 'Florence Thomassin', 'Valérie Benguigui', 'Monique Chaumette', 'Laure Marsac', 'Stéphan Guérin-Tillié']",[],"Several lives are changed after a teenager from a rough suburb throws a Molotov cocktail on a car, sending the doctor who was in it in a coma.",87
tt1391137,Why Did I Get Married Too?,Movie,Drama,2010,4.0,NO DATA,"['tt1391137', 'Janet Jackson', 'Tyler Perry', 'Jill Scott', 'Sharon Leal', 'Malik Yoba', 'Richard T. Jones', 'Tasha Smith', 'Lamman Rucker', 'Michael Jai White', 'Louis Gossett Jr.']",[],"Four couples struggle to save their marriages once again on their annual marriage retreat, while each of them battle through financial, physical, mental, and emotional issues.",87
tt1391481,"Renn, wenn du kannst",Movie,Drama,2010,7.0,NO DATA,"['tt1391481', 'Robert Gwisdek', 'Jacob Matschenz', 'Anna Brüggemann', 'Daniel Drewes', 'Amelie Kiefer', 'Franziska Weisz', 'Michael Sens', 'Leslie Malton', 'Jörg Bundschuh', 'Sven Taddicken']",[],"Christian is assigned as an assistant to Benjamin, a disabled man. On his first day he runs into a cello player named Annika, and the three end up in a love triangle.",NO DATA
tt1391745,Whale,Movie,Drama,2010,3.0,NO DATA,"['tt1391745', 'Amir Motlagh', 'Darren Oneil', 'Micheal Flowers', 'Kindy Barr', 'Rastin Ashtiani', 'Yousef Motlagh', 'Atefeh Galledari', 'Martin Nilchian']",[],Twenty-nine-year-old Iranian-American writer Cameron moves back into his mother's Orange County home to nurse a broken heart and recapture his creativity.,Formato min incorrecto
tt1392744,Chance Pe Dance,Movie,Drama,2010,1.0,NO DATA,"['tt1392744', 'Shahid Kapoor', 'Genelia Deshmukh', 'Mohnish Behl', 'Satish Shah', 'Parikshit Sahni', 'Vikas Bhalla', 'Prince Rodde', 'Kurush Deboo', 'Bizz Kanwarpal', 'Mannu Rishi']",[],New love convinces a struggling actor and dancer to enter a talent competition that could make him a superstar.,122
tt1392982,Desafío,Movie,Drama,2010,11.0,NO DATA,"['tt1392982', 'Ari Brickman', 'Rocío Verdejo', 'Marina de Tavira', 'Andrés Montiel', 'José Sefami', 'Maximiliano Villegas', 'Julio Bracho', 'Alejandro Caso', 'Rodrigo Murray', 'Arturo Barba']",[],A professional race car driver faces hardships when he switches teams and leaves his family.,89
tt1393020,Sex & Drugs & Rock & Roll,Movie,Drama,2010,1.0,NO DATA,"['tt1393020', 'Andy Serkis', 'Tom Hughes', 'Clifford Samuel', 'Joseph Kennedy', 'Arthur Darvill', 'James Jagger', 'Shakraj Soornack', 'Mackenzie Crook', 'Olivia Williams', 'Sam Spruell']",[],"A biography of Ian Dury, who was stricken with polio at a young age and defied expectations by becoming one of the founders of the punk-rock scene in Britain in the 1970s.",NO DATA
tt1393746,Tang shan da di zhen,Movie,Drama,2010,7.0,NO DATA,"['tt1393746', 'Daoming Chen', 'Chen Li', 'Yi Lu', 'Fan Xu', 'Jingchu Zhang', 'Zifeng Zhang', 'Jiajun Zhang', 'Guoqiang Zhang', 'Ziwen Wang', 'Lixin Yang']",[],La historia épica de una familia separada por el gran terremoto de Tangshan en 1976.,Formato min incorrecto
tt1394211,Helena from the Wedding,Movie,Drama,2010,3.0,NO DATA,"['tt1394211', 'Dagmara Dominczyk', 'Paul Fitzgerald', 'Dominic Fumusa', 'Jessica Hecht', 'Gillian Jacobs', 'Melanie Lynskey', 'Corey Stoll', 'Lee Tergesen', 'Jason Shanski']",[],Newlyweds Alex and Alice host a New Year's Eve party for their closest friends at a remote cabin in the mountains. An unexpected addition arrives and the group's facades begin to crumble.,Formato min incorrecto
tt1395054,Once Upon a Time in Mumbaai,Movie,Drama,2010,7.0,NO DATA,"['tt1395054', 'Ajay Devgn', 'Emraan Hashmi', 'Kangana Ranaut', 'Prachi Desai', 'Randeep Hooda', 'Naved Aslam', 'Sanjeev Wilson', 'Allauddin Khan', 'Rajeev Yadav', 'Sushil Pandey']",[],"As a smuggler rises to power in in 1970s Mumbai, a younger gangster seeks to overthrow him and a police officer is caught in the middle.",Formato min incorrecto
tt1396221,Passion Play,Movie,Drama,2011,7.0,NO DATA,"['tt1396221', 'Mickey Rourke', 'Megan Fox', 'Bill Murray', 'Kelly Lynch', 'Rhys Ifans', 'Chuck Liddell', 'Chris Browning', 'Mark Sivertsen', 'John Cenatiempo', 'Rory Cochrane']",[],An angel under the thumb of a ruthless gangster is saved by a trumpet player down on his luck.,Formato min incorrecto
tt13962956,Lo sceicco di Castellaneta,Movie,Drama,2010,11.0,NO DATA,"['tt13962956', 'Ilaria Cangialosi', 'Dante Marmone']",[],,51
tt1397176,Gardiens de l'ordre,Movie,Drama,2010,4.0,NO DATA,"['tt1397176', 'Cécile de France', 'Fred Testot', 'Julien Boisselier', 'Nicolas Marié', 'Stéphan Wojtowicz', 'Nanou Garcia', 'Stéphane Jobert', 'Jean-Michel Noirey', 'Gilles Gaston-Dreyfus', 'Foued Nassah']",[],"When a typical response to a supposedly simple noise complaint gets out of hand, two Police Officers will come face-to-face with the city's seedy underworld, determined to clear their names.",51
tt13972284,Nunc Et in Hora,Movie,Drama,2010,11.0,NO DATA,"['tt13972284', 'Luisa Aguado', 'Eva Barceló', 'Maria Gray', 'Julián Ortega', 'Àlvar Zarco']",[],,NO DATA
tt1397498,Kong Zi,Movie,Drama,2010,1.0,NO DATA,"['tt1397498', 'Chow Yun-Fat', 'Xun Zhou', 'Jianbin Chen', 'Quan Ren', 'Yi Lu', 'Yao Lu', 'Kai Li', 'Ban Wang', 'Huanshan Xu', 'Jingwu Ma']",[],La historia de la vida del influyente filósofo chino Confucio.,NO DATA
tt1398029,Das Lied in mir,Movie,Drama,2011,2.0,NO DATA,"['tt1398029', 'Jessica Schwarz', 'Michael Gwisdek', 'Rafael Ferro', 'Beatriz Spelzini', 'Alfredo Castellani', 'Marcela Ferrari', 'Carlos Portaluppi']",[],"During a stopover in Buenos Aires on her way to Chile, 31-year-old Maria recognizes a nursery rhyme. Maria doesn't speak a work of Spanish, but without understanding what she is singing, she remembers the Spanish lyrics. Disturbed and thrown off course, she decides to interrupt her journey and wander through the unfamiliar city. On the phone to Germany, she tells her ... Leer todo",94
tt1398028,Locked In,Movie,Drama,2010,9.0,NO DATA,"['tt1398028', 'Ben Barnes', 'Sarah Roemer', 'Eliza Dushku', 'Johnny Whitworth', 'Clarke Peters', 'Peter Jason', 'Abby Steinman', 'Helen Steinman', 'Brenda Fricker', 'Diego Arciniegas']",[],"Josh leaves his advertising career at its peak, everyone wants either to be him or to have him. A car accident will leave his daughter in a strange coma and when everyone has given up she starts communicating with him, or is he going mad?",94
tt1398399,O Último Voo do Flamingo,Movie,Drama,2010,9.0,NO DATA,"['tt1398399', 'Eliote Alex', 'Adriana Alves', 'Cândida Bila', ""Carlo D'Ursi"", 'Mário Mabjaia', 'Alberto Magassela', 'Gilberto Mendes', 'Cláudia Semedo']",[],"Tizangara, Mozambique. After the peace agreement. A mystery. UN soldiers exploding. An investigation is begun and Massimo is appointed to solve the mystery. Joaquim will have to translate, not only the words but the facts, in order for him to understand.",NO DATA
tt1399102,Trailerpark,Movie,Drama,2010,3.0,NO DATA,"['tt1399102', 'Merri Biechler', 'Jon Farris', 'Shelley Delaney', 'Tyler Rollinson', 'Mark Mann', 'Nate Bigger', 'Dinah Berkeley', 'John Atzberger', 'Janice Paxson Evans', 'Lilly Herold']",[],"Ever wonder what's going on next door? Ever spy on your neighbors, gossip behind their backs? Well, if you live here you do. A story concerning 13 neighbors stuck in an small trailer park. It is all about human connections.",110
tt1399125,Wid Winner and the Slipstream,Movie,Drama,2010,3.0,NO DATA,"['tt1399125', 'James Sheldon', 'Alexander Wright', ""Erin Allin O'Reilly""]",[],"The story of two lonesome men on a road trip in search of glory, redemption, and a mystical machine built out of used auto parts",50
tt1399683,Winter's Bone,Movie,Drama,2010,11.0,NO DATA,"['tt1399683', 'Jennifer Lawrence', 'John Hawkes', 'Garret Dillahunt', 'Isaiah Stone', 'Ashlee Thompson', 'Valerie Richards', 'Shelley Waggener', 'William White', 'Ramona Blair', 'Lauren Sweetser']",[],"Una chica de Ozark Mountain se adentra en un peligroso terreno social cuando da caza a su padre, traficante de drogas, mientras intenta mantener a su familia a salvo.",50
tt1399655,Jud Süss - Film ohne Gewissen,Movie,Drama,2010,8.0,NO DATA,"['tt1399655', 'Tobias Moretti', 'Martina Gedeck', 'Moritz Bleibtreu', 'Justus von Dohnányi', 'Armin Rohde', 'Anna Unterberger', 'Heribert Sasse', 'Ralf Bauer', 'Martin Feifel', 'Paula Kalenberg']",[],"Rise and fall of actor Ferdinand Marian, who takes the chance and stars in the anti-semitic movie El judio Suss (1940).",Formato min incorrecto
tt1400335,First Dog,Movie,Drama,2012,12.0,NO DATA,"['tt1400335', 'Eric Roberts', 'Eliza Roberts', 'John-Paul Howard', 'Little Bear', 'Tom Lister Jr.', 'Priscilla Barnes', 'Paula Devicq', 'Tim Peyton', 'Linda Bella', 'Paula Nelson']",[],"A foster boy is befriended by a lost dog who turns out to belong to the President of the United States. The boy decides to run away from the foster home to return the canine to the White House -- ""Because it's the right thing to do!""",Formato min incorrecto
tt1400558,Zatôichi: The Last,Movie,Drama,2010,5.0,NO DATA,"['tt1400558', 'Shingo Katori', 'Takashi Sorimachi', 'Satomi Ishihara', 'Chieko Baishô', 'Mike Han', 'Yoshio Harada', 'Arata Iura', 'Kôichi Iwaki', 'Seishirô Katô', 'Yûki Kudô']",[],A blind master swordsman attempts to lead a quiet life with his wife but he is provoked back into battle.,132
tt1401607,The Con Artist,Movie,Drama,2010,11.0,NO DATA,"['tt1401607', 'Rossif Sutherland', 'Sarah Roemer', 'Greg Germann', 'Russell Peters', 'Donald Sutherland', 'Jed Rees', 'Mac Fyfe', 'Rebecca Romijn', 'Sabrina Grdevich', 'Joel Thomas Hynes']",[],An ex-con finds his plan to go straight foiled by a loan shark who manipulates his target into taking on one last heist.,132
tt1401643,Vénus noire,Movie,Drama,2011,1.0,NO DATA,"['tt1401643', 'Yahima Torres', 'Andre Jacobs', 'Olivier Gourmet', 'Elina Löwensohn', 'François Marthouret', 'Michel Gionti', 'Jean-Christophe Bouvet', 'Jonathan Pienaar', 'Rémi Martin', 'Jean-Jacques Moreau']",[],"En el siglo XIX, una mujer negra africana se exhibe en toda Europa como una curiosidad exótica.",Formato min incorrecto
tt1401669,La petite chambre,Movie,Drama,2011,2.0,NO DATA,"['tt1401669', 'Florence Loiret Caille', 'Michel Bouquet', 'Éric Caravaca', 'Joël Delsaut', 'Valérie Bodson', 'Fabienne Barraud', 'Frédéric Landenberg', 'Antonio Buíl', 'Paulin Jaccoud', 'Iannis Jaccoud']",[],"One day, a bad fall forces Edmond to accept Rose's help. Eventually, the two grow closer. The young woman finds relief in confiding painful memories to the older man; things she cannot even bring herself to tell her husband. Meanwhile, Edmond, too, opens up, sharing recollections of his beloved wife.",87
tt1401672,Sedamdeset i dva dana,Movie,Drama,2010,7.0,NO DATA,"['tt1401672', 'Rade Serbedzija', 'Kresimir Mikic', 'Bogdan Diklic', 'Zivko Anocic', 'Mira Banjac', 'Dejan Acimovic', 'Lucija Serbedzija', 'Nebojsa Glogovac', ""Predrag 'Predjo' Vusovic"", 'Dragan Nikolic']",[],"A family from isolated village in Lika makes a good living out of American pension earned by their late granddad Djuradj and received by his widow Nedja. The very existence of a family is threatened when Nedja dies, but the head of the family comes up with a cunning plan.",93
tt1403047,Aurora,Movie,Drama,2011,3.0,NO DATA,"['tt1403047', 'Afrodita Andone', 'Geo Aur', 'Andrei Barbu', 'Anda Barleanu', 'Alexandra Blejan', 'Richard Bovnoczki', 'Ioana Calota', 'Marinana Camarasan', 'Cici Caraman', 'Dana Cavaleru']",[],Viorel a 42 year old man troubled by obscure thoughts drives across the city to a destination known only to him.,NO DATA
tt1403147,Dance with Me,Movie,Drama,2010,4.0,NO DATA,"['tt1403147', 'Ismael Ludman', 'Johanne Murdock', 'Adam Napier', 'Jane Stanton', 'Guggi Zuzakova']",[],"Love is like a tango - light or dark, you can't dance it alone.",82
tt1403144,Cosa voglio di più,Movie,Drama,2010,10.0,NO DATA,"['tt1403144', 'Alba Rohrwacher', 'Pierfrancesco Favino', 'Teresa Saponangelo', 'Giuseppe Battiston', 'Fabio Troiano', 'Monica Nappo', 'Tatiana Lepore', 'Sergio Solli', 'Gisella Burinato', 'Gigio Alberti']",[],"Un día, en la fiesta de despedida de un colega, Anna conoce a Domenico, un tipo viril, algo mayor que ella, casado y con dos hijos pequeños. Las llamas de la pasión se encienden rápidamente y dan lugar a tórridos encuentros.",82
tt1403177,Hesher,Movie,Drama,2012,2.0,NO DATA,"['tt1403177', 'Joseph Gordon-Levitt', 'Devin Brochu', 'Natalie Portman', 'Rainn Wilson', 'Piper Laurie', 'Brendan Hill', 'John Carroll Lynch', 'Monica Staggs', 'Mary Elizabeth Barrett', 'Audrey Wasilewski']",[],"Un niño que ha perdido a su madre está perdiendo el contacto con su padre y el mundo que lo rodea. Luego conoce a Hesher, hace su vida aún más caótica.",82
tt1403249,Suicide Dolls,Movie,Drama,2012,7.0,NO DATA,"['tt1403249', 'LaQuita Cleare', 'Christy Carlson Romano', 'Heather Tom', 'Steven Bauer', 'Joanna Stancil', 'Anne-Marie Johnson', 'Ryan Carnes', 'Whitmer Thomas', 'Ayo Sorrells', 'Gillian Perdeau']",[],Two lonely girls plan to commit suicide and decide to chronicle their last 24 hours. Their last day takes them to the edge and back as they face past demons and the biggest decision of all...Do they go through with it?,91
tt14032882,Aaji Aani Naat,Movie,Drama,2010,,NO DATA,"['tt14032882', 'Amruta Deshmukh', 'Sulabha Deshpande', 'Prajakta Kelkar', 'Aashish Kulkarni', 'Ashok Shinde', 'Tejashree Walawalkar']",[],"Amey and Shama are well known doctors and live with their daughter Akshata and full fill all her dreams but Akshata feels that she should also have loving grandparents.Amey and Shama unfortunately cant full fill this wish as they both are orphans,Akshata accidentally dials a call and meets an old lady Sumitra on the other line.Sumitra lives a lonely life as her son Su... Leer todo",NO DATA
tt1403981,Remember Me,Movie,Drama,2010,4.0,NO DATA,"['tt1403981', 'Robert Pattinson', 'Emilie de Ravin', 'Caitlyn Rund', 'Moisés Acevedo', 'Noel Rodriguez', 'Kevin P. McCarthy', 'Chris Cooper', 'Athena Currey', 'Lena Olin', 'Gregory Jbara']",[],"Tyler, cuyos padres se han separado a raíz del suicidio de su hermano, y Ally, que vive cada día al máximo desde que fue testigo del asesinato de su madre, entablan una relación.",NO DATA
tt1403865,True Grit,Movie,Drama,2011,2.0,NO DATA,"['tt1403865', 'Jeff Bridges', 'Matt Damon', 'Hailee Steinfeld', 'Josh Brolin', 'Barry Pepper', 'Dakin Matthews', 'Jarlath Conroy', 'Paul Rae', 'Domhnall Gleeson', 'Elizabeth Marvel']",[],Una adolescente testaruda reclama la ayuda de un duro marshal para localizar al asesino de su padre.,NO DATA
tt1403987,Rage,Movie,Drama,2010,5.0,NO DATA,"['tt1403987', 'Audrey Walker', 'Ricky Crawford', 'Chris Witherspoon', 'Jo Black-Jacob', 'Spencer Conway', 'Anna Lodej', 'M.L. Maltz', 'Richard Topping']",[],"A thirty something man who lives in a suburb just outside of Portland says goodbye to his beautiful and loving wife and heads into town. There he unintentionally provokes the wrath of a mysterious motorcyclist. The confrontation between the two, sets in motion a day long battle. Beginning in the form of harmless taunts then quickly escalating into something more serio... Leer todo",85
tt1403846,Alting Bliver Godt Igen,Movie,Drama,2010,1.0,NO DATA,"['tt1403846', 'Jens Albinus', 'Igor Radosavljevic', 'Marijana Jankovic', 'Thomas Høite Meersohn', 'Özlem Saglanmak', 'Benjamin Boe Rasmussen', 'Nicolas Bro', 'Dulfikar Al-Jabouri', 'Muhammed Tehaibech', 'Rasmus Botoft']",[],"Jacob Falk, a writer/director known for becoming obsessed with his own stories, stumbles upon photographs of prisoners of war being tortured by Danish soldiers. Suspecting a political conspiracy, Falk falls into a frenetic chase to reveal the mystery behind the photos, which leads him to discover a much more disturbing truth.",NO DATA
tt1403988,The Romantics,Movie,Drama,2010,5.0,NO DATA,"['tt1403988', 'Katie Holmes', 'Anna Paquin', 'Josh Duhamel', 'Malin Akerman', 'Adam Brody', 'Dianna Agron', 'Jeremy Strong', 'Rebecca Lawrence Levy', 'Candice Bergen', 'Elijah Wood']",[],"Siete amigos cercanos se reúnen para la boda de dos de sus amigos. Sin embargo, surgen problemas porque la novia y la dama de honor han tenido una larga rivalidad por el novio.",NO DATA
tt1404366,Subete wa umi ni naru,Movie,Drama,2010,1.0,NO DATA,"['tt1404366', 'Makiko Watanabe', 'Sakura Ando', 'Megumi Han', 'Yûya Yagira', 'Yuriko Yoshitaka', 'Yutaka Matsushige', 'Alice Hirose', 'Jun Murakami', 'Mina Fujii', 'Jun Kaname']",[],"Natsuki, a sales clerk of a bookstore, and Koji. a high school student. Seemingly nothing in common, they have one thing they can share; the books. While keeping empty relationship with a man working at a major publishing house, Natsuki becomes closer to younger Koji trying to rebuild his dysfunctional family all alone.",120
tt1404632,Cherry.,Movie,Drama,2011,9.0,NO DATA,"['tt1404632', 'Rey Valentin', 'Lili Bordán', 'David Crane', 'Benjamin Riley', 'Ben DiGregorio', 'Brent Falco', 'Jeremy Radin', 'Keith Roenke', 'Craig Pollack', 'Jackie Collins']",[],"When Brian Cherry, a sweet, sensitive young Los Angelino, falls for the beautiful, electric, and damaged Jules, she turns his ideas about women and sex upside-down. Slowly, he is drawn into a twisted love-triangle that includes Jules and his best friend, Sam. When Jules eventually leaves him for Sam, Cherry decides on a shocking course of action that will destroy the ... Leer todo",Formato min incorrecto
tt1405426,Gone,Movie,Drama,2010,4.0,NO DATA,"['tt1405426', 'John Brotherton', 'George Castan', 'Andre Coney', 'Joey Covington', 'Eric Escalante', 'Becky Garcia', 'Adam Green', 'Jeff Holt', 'Dustin Loreque', 'Sarah Maine']",[],"Quiet and hard working, Mike is a young man who works and lives in the city. Due to a dark past, he is forbidden by law to be in his home town and have any prior contacts. One phone call four years later will change all of this and Mike will be forced to return to his home. With help from some of Mike's friends and family, he will do what he can to make things right. ... Leer todo",75
tt1405500,For Colored Girls,Movie,Drama,2010,11.0,NO DATA,"['tt1405500', 'Janet Jackson', 'Anika Noni Rose', 'Whoopi Goldberg', 'Kimberly Elise', 'Loretta Devine', 'Thandiwe Newton', 'Kerry Washington', 'Tessa Thompson', 'Phylicia Rashad', 'Macy Gray']",[],"Cada una de las mujeres retrata a uno de los personajes representados en la colección de veinte poemas, revelando diferentes temas que impactan a las mujeres en general y a las mujeres de color en particular.",75
tt1405810,Mine vaganti,Movie,Drama,2011,5.0,NO DATA,"['tt1405810', 'Riccardo Scamarcio', 'Nicole Grimaudo', 'Alessandro Preziosi', 'Ennio Fantastichini', 'Lunetta Savino', 'Ilaria Occhini', 'Bianca Nappi', 'Carmine Recano', 'Massimiliano Gallo', 'Paola Minaccioni']",[],"Tommaso, el pequeño de los Cantones, una familia italiana tradicional del sur de Italia, decide contarles a sus padres que tiene novio.",NO DATA
tt1406166,Legenda o Lietajúcom Cypriánovi,Movie,Drama,2010,7.0,NO DATA,"['tt1406166', 'Marko Igonda', 'Ryszard Ronczewski', 'Aleksandr Domogarov', 'Karolina Kominek-Skuratowicz', 'Pawel Malaszynski', 'Radoslav Brzobohatý', 'Ivan Romancík', 'Lukács Bicskey', 'Vladimír Javorský', 'Kristína Mecko']",[],"Historic adventurism movie inspirited by legend about mystery monk, alchemist and healer who made the flying machine according to lost book wrote by Leodardo DaVinci in 18th century.",108
