tt1323045,Frozen,Movie,Drama,2010,3.0,NO DATA,"['tt1323045', 'Shawn Ashmore', 'Emma Bell', 'Kevin Zegers', 'Ed Ackerman', 'Rileah Vanderbilt', 'Kane Hodder', 'Adam Johnson', 'Chris York', 'Peder Melhuse', 'Will Barratt']",[],"Tres esquiadores aislados en un telesilla se ven obligados a tomar decisiones de vida o muerte, lo que resulta más peligroso que quedarse y congelarse hasta morir.",NO DATA
tt1324061,Zena sa slomljenim nosem,Movie,Drama,2011,7.0,NO DATA,"['tt1324061', 'Nebojsa Glogovac', 'Nada Sargin', 'Anica Dobra', 'Branka Katic', 'Vuk Kostic', 'Jasna Zalica', 'Nikola Rakocevic', 'Vojin Cetkovic', 'Ljubomir Bandovic', 'Dubravka Kovjanic']",[],"The act of a woman with a broken nose, who suddenly jumps out of a taxi and throws herself off the bridge in Belgrade, connects the lives of three witnesses. The suicide attempt becomes the existential catalyst to the misanthropist taxi-driver Gavrilo who tries to avoid any kind of emotional commitment, the school teacher Anica, stubbornly rejecting the attentions of ... Leer todo",NO DATA
tt1325004,The Twilight Saga: Eclipse,Movie,Drama,2010,6.0,NO DATA,"['tt1325004', 'Kristen Stewart', 'Robert Pattinson', 'Taylor Lautner', 'Xavier Samuel', 'Billy Burke', 'Justin Chon', 'Anna Kendrick', 'Michael Welch', 'Christian Serratos', 'Jackson Rathbone']",[],"Mientras una serie de asesinatos misteriosos tienen lugar en Seattle, Bella tiene que elegir entre su amor por el vampiro Edward y su amistad con el hombre lobo Jacob.",NO DATA
tt1325743,Five Star Day,Movie,Drama,2011,11.0,NO DATA,"['tt1325743', 'Cam Gigandet', 'Guy Herbert', 'Will Yun Lee', 'Derek Shipp', 'Brooklyn Sudano', 'Julianna Guill', 'Max Hartman', 'Peter Mackenzie', 'Parisa Fakhri', 'Chris Johnson']",[],"One man's journey to disprove the theory of astrology leads him to answer some bigger question about life, love, fate and destiny.",Formato min incorrecto
tt1326238,Backlight,Movie,Drama,2010,7.0,NO DATA,"['tt1326238', 'Joaquim de Almeida', 'Michelle Mania', 'Skyler Day', 'Scott Bailey', 'Joey Hagler', 'Evelina Pereira', 'Donovan Scott', 'Ana Cristina de Oliveira', 'Jeff Swarthout', 'Renee Ainsworth']",[],Several characters who are each at critical stages of their lives are strangely impelled towards an uncharted lake in the middle of the desert where they all have the opportunity to save each other.,90
tt1326253,Poppies: Odyssey of an Opium Eater,Movie,Drama,2010,,NO DATA,"['tt1326253', 'David Bertelsen', 'Leah McCormick', 'Brian Oblak', 'Marina Pincus', 'Alex Wicks', 'Mike Roland', 'Ian Destefano', 'Sydney Sweeney', 'Trent Sweeney', 'Nick Rish']",[],A coat-and-tie-wearing social worker scours the countryside in search of wild opium poppies.,90
tt1326272,The Unseen,Movie,Drama,2010,,NO DATA,"['tt1326272', 'Ross Preller', 'Julin', 'Michael Austin Parker', 'Hunter Garner', 'Josh Durham', 'Cody Hinson', 'Tetia Stroud', 'Kendall Mitchell', 'James Daniel Burns Williams', 'Heather Okun']",[],"When Scott takes Trisha on a drive, she is skeptical when he pulls up at an old abandoned farmhouse. He has heard rumors of a cool hangout and his curiosity gets the best of him when he opens the door and just walks in. Trisha is troubled when she sees a little girl that vanishes before her eyes, but when she makes it inside, this old house doesn't seem so abandoned..... Leer todo",NO DATA
tt1326960,Roman's Bride,Movie,Drama,2010,,NO DATA,"['tt1326960', 'Anne Paul', 'Mike Rennat', 'Otis Wilson', 'Stanley Massey', 'Elmer Chalmers', 'Lisa Rennat', 'Lee Rennat', 'Elyse Rennat', 'Jim Siokos', 'Jennifer Galbraith']",[],"Roman's Bride tells the story of Lily Heller, an Iowa woman torn between a repressive faith and an unrequited love for life-long neighbor Roman. Indulged in her world only by doting childhood friend Amos, Lily lives her life in a self-restricted isolation. When roman and his girlfriend announce plans to marry, Lily's fragile psyche collides fiercely with an immorality... Leer todo",85
tt1326801,Should've Kissed,Movie,Drama,2010,,NO DATA,"['tt1326801', 'Bastien Ballat', 'John Blair II', 'Jacob Bluhm', 'Lena Diechle', 'Corey Hoelker', 'Tom Jarmusch', 'Gerald Keyzer', 'Catherine Lipinski', 'Marina Michelson', 'Jinoh Park']",[],,NO DATA
tt1327809,Scontro di civiltà per un ascensore a Piazza Vittorio,Movie,Drama,2010,5.0,NO DATA,"['tt1327809', 'Paolo Calabresi', 'Pierluigi Cicchetti', 'Gresy Cipriani', 'Roberto Citran', 'Vincenzo Crivello', 'Isa Danieli', 'Ninetto Davoli', 'Massimo De Santis', 'Luigi Diberti', 'Kesia Elwin']",[],"A decadent building in Rome, filled with residents that can't find ways of connecting with each other, goes through a critical condition when some of the people opt to ignore the new rules concerning the use of the elevator. Tension rises between neighbors, families and outsiders from many different cultural and social backgrounds, and those clashes reveal attitudes o... Leer todo",100
tt1328867,Some Days Are Better Than Others,Movie,Drama,2011,6.0,NO DATA,"['tt1328867', 'Carrie Brownstein', 'James Mercer', 'David Wodehouse', 'Renee Roman Nose', 'Nina Henderson', 'Oksana Musall', 'Luke Clements', 'Cora Benesh', 'Paige Oster', 'Amber Arambul']",[],"Some Days are Better Than Others is Matt McCormick's poetic, character-driven debut feature-length film that asks why the good times slip by so fast while the difficult times seem so sticky.",Formato min incorrecto
tt1328911,Limbo Lounge,Movie,Drama,2010,4.0,NO DATA,"['tt1328911', 'Ronnie Marmo', 'Robyn Cohen', 'Tamara Braun', 'Brian Groh', 'David E. Willis', 'Thomas J. Colavito', 'Stephanie Lemelin', 'Joseph McKelheer', 'Mitzi McCall', 'Charlie Brill']",[],"After encountering gridlock on the highway to Heaven and Hell, a recently deceased conman attempts to work his way down the ladder by corrupting an innocent person.",90
tt1328908,Bold Native,Movie,Drama,2010,,NO DATA,"['tt1328908', 'Joaquin Pastor', 'Randolph Mantooth', 'Sheila Vand', 'Matt Shea', 'Kristine Louise', 'Tonya Kay', 'Ursula Whittaker', 'Jessica Hagan', 'Jaime Andrews', 'Aflamu Johnson']",[],"Charlie Cranehill, an animal liberator wanted for domestic terrorism, emerges from the underground to coordinate a nationwide action as his estranged CEO father tries to find him before the FBI does.",90
tt1328913,Preacher's Kid,Movie,Drama,2010,1.0,NO DATA,"['tt1328913', 'LeToya Luckett', ""Durrell 'Tank' Babbs"", 'Tammy Townsend', 'Carlos Davis', 'Andre Butler', 'Nadiyah Hollis', 'Javen Campbell', 'Clayton English', 'Kelly Finley', 'Ella Joyce']",[],"Tired of being a Preacher's daughter and longing to experience more of life, 20-something ANGIE KING strikes out on her own for the very first time and joins a traveling gospel show.",NO DATA
tt1329330,Yeardley,Movie,Drama,2010,,NO DATA,"['tt1329330', 'Jesse Bernstein', 'Saskia Grace Holmes', 'Garrett Geoghegan', 'Rebecca Holopter', 'Madison Palasini', 'Dave Heuvel', 'Mac Jay', 'Sarah Yahr Tucker', 'Caroline Timm', 'Warren Herr']",[],"Jeff Yeardley (Jesse Bernstein) is a self-absorbed, middle class programmer who loses his wife (Saskia Grace Holmes) and son when his affair with a co-worker is revealed. Jeff struggles to find a new job amid the U.S. economic recession, but the reputation of sexual harassment follows him. While trying to reform and win back his family, Jeff is targeted by two colleag... Leer todo",90
tt13293222,Summer Dark,Movie,Drama,2010,,NO DATA,"['tt13293222', 'Wil Bol', 'Emma Brown', 'Chrissie Collins', 'Tush Enaker', 'Dan Fry', 'Nathan Fry', 'Olivia Fry', 'Marie Hunt', 'Taryn Kay', 'Cheryl Knight']",[],,90
tt1329445,Summer Blink,Movie,Drama,2010,10.0,NO DATA,"['tt1329445', 'Tana Sirois', 'Ashley Love', 'Jeff Bernhardt', 'Dylan S. Wallach', 'Matthew Cost', 'Erin Adams', 'Joi Smith']",[],"Mina is 18. She is graduating from high school and is facing the summer that is the prologue to her new life. A life of no college plans, no job, no money, and no idea of what she's going to do once September comes and all of her friends are gone to college. But she does have the summer, and an opportunity to still surprise herself by what life can bring when you leas... Leer todo",125
tt1329457,Gainsbourg (Vie héroïque),Movie,Drama,2010,3.0,NO DATA,"['tt1329457', 'Eric Elmosnino', 'Lucy Gordon', 'Laetitia Casta', 'Doug Jones', 'Anna Mouglalis', 'Mylène Jampanoï', 'Sara Forestier', 'Kacey Mottet Klein', 'Razvan Vasilescu', 'Dinara Drukarova']",[],"A glimpse at the life of French singer Serge Gainsbourg, from growing up in 1940s Nazi-occupied Paris through his successful song-writing years in the 1960s to his death in 1991 at the age of 62.",NO DATA
tt1330022,Everything Nice,Movie,Drama,2010,,NO DATA,"['tt1330022', 'Isabelle Rosellini', 'Tony Devon', 'Oscar Bendgi', 'Neville Connors', 'Keith Easter', 'Irene Lincoln', 'Jerry Noble', 'Gloria Staples', 'Katherine Scott', 'Beau Cantrell']",[],A stranger in a young boy's dream becomes a reality.,NO DATA
tt1330229,Memoirs of a Teenage Amnesiac,Movie,Drama,2010,3.0,NO DATA,"['tt1330229', 'Maki Horikita', ""Ken'ichi Matsuyama"", 'Yûya Tegoshi', 'Anton Yelchin', 'Anri Chomentowska', 'Emma Roberts', 'Kylee', 'Mirei Kiritani', 'Misa Shimizu', 'Karen Kirishima']",[],"Diving to save a camera from a fall down a flight of stairs, high school junior Naomi Sukuse wakes with no memory of the last four years. Naomi must remember who she was and figure out who she wants to be in this story of love and second chances.",124
tt1331112,Other Side of the Game,Movie,Drama,2010,11.0,NO DATA,"['tt1331112', 'Simon Paul Sutton', 'Ben Bailey Smith', 'Ayse Tezel', 'Bill Fellows', 'Scott Davis', 'Henry Douthwaite', 'Emile Jansen', 'Elio Ruggieri', 'Natalie Louka', 'Gary Condés']",[],"Tony Cole knows that for the last ten years he's been caught in a downward spiral. Selling drugs was never a crime, but it was never meant to be his career. Now he's frustrated with his mundane daily routine and can no longer live with the constant threat of getting caught. But Tony doesn't realise that his middle class customers will never accept him as anything but ... Leer todo",Formato min incorrecto
tt1332110,Mesa sto dasos,Movie,Drama,2010,9.0,NO DATA,"['tt1332110', 'Katia Goulioni', 'Iakovos Kamhis', 'Nathan Pissoort']",[],"Enormous tree trunks. The nature of leaves, the roots of desire and a house hidden deep in the forest. A journey to the other side. Something like a ""punk"" existential fairytale.",97
tt1332134,Kongen av Bastøy,Movie,Drama,2011,12.0,NO DATA,"['tt1332134', 'Benjamin Helstad', 'Trond Nilssen', 'Stellan Skarsgård', 'Kristoffer Joner', 'Magnus Langlete', 'Morten Løvstad', 'Daniel Berg', 'Odin Gineson Brøderud', 'Magnar Botten', 'Markus Brustad']",[],"Norwegian winter, early 20th century. On the boys home Bastoy, a new inmate leads the boys to a violent uprising against a brutal regime. How far is he willing to go to attain freedom?",NO DATA
tt1332133,180° - Wenn deine Welt plötzlich Kopf steht,Movie,Drama,2010,9.0,NO DATA,"['tt1332133', 'Christopher Buchholz', 'Sophie Rois', 'Michael Neuenschwander', 'Benjamin Grüter', 'Carla Juri', 'Güven Kiraç', 'Siir Eloglu', 'Mehmet Atesci', 'Asli Bayram', 'Firat Kaplan']",[],"Early evening - a big city. Two teenagers shyly flirt with each other, a housewife sits down to watch her daily soap, nurses in a hospital gossip before the nightshift starts, a trendy couple drives through rush hour, so excited they can hardly wait to get home - a man with a rifle enters a building seeking revenge. In the blink of an eye seemingly unrelated events tu... Leer todo",96
tt1332486,Baciami ancora,Movie,Drama,2011,1.0,NO DATA,"['tt1332486', 'Stefano Accorsi', 'Vittoria Puccini', 'Pierfrancesco Favino', 'Claudio Santamaria', 'Giorgio Pasotti', 'Marco Cocci', 'Sabrina Impacciatore', 'Daniela Piazza', 'Primo Reggiani', 'Lina Bernardi']",[],"A look at the lives of Carlo, Giulia, and their friends some 10 years after the events of L'Ultimo bacio.",139
tt1334318,Hora proelefsis,Movie,Drama,2010,10.0,NO DATA,"['tt1334318', 'Amalia Moutousi', 'Thanos Samaras', 'Ioanna Tsirigouli', 'Errikos Litsis', 'Ieronymos Kaletsanos', 'Youla Boudali', 'Christos Passalis', 'Despina Georgakopoulou', 'Nikos Flessas', 'Marisha Triantafyllidou']",[],"In a country shaken by major political events, three generations of a Greek family clash over an inside-the-family adoption.",106
tt1334532,Farewell,Movie,Drama,2010,4.0,NO DATA,"['tt1334532', 'Olga Generalova', 'Vladimiras Jefremovas', 'Larisa Kalpokaite', 'Kristina Kazlauskaite', 'Dainius Kazlauskas', 'Albinas Keleris', 'Vaidotas Martinaitis', 'Aleksandra Metalnikova', 'Vytautas Rumsas', 'Arunas Sakalauskas']",[],A sailor with a fatal blood disease takes his leave of the people and places he loves.,90
tt1334260,Never Let Me Go,Movie,Drama,2011,4.0,NO DATA,"['tt1334260', 'Keira Knightley', 'Carey Mulligan', 'Andrew Garfield', 'Izzy Meikle-Small', 'Charlie Rowe', 'Ella Purnell', 'Charlotte Rampling', 'Sally Hawkins', 'Kate Bowes Renna', 'Hannah Sharp']",[],"Kathy, Tommy y Ruth pasan su infancia en Hailsham, un internado inglés aparentemente idílico, donde descubren un tenebroso e inquietante secreto sobre su futuro. Cuando abandonan el colegio y se aproximan al destino que les aguarda, el amor, los celos y la traición amenazan con separarlos.",NO DATA
tt1334470,Raavan,Movie,Drama,2010,6.0,NO DATA,"['tt1334470', 'Abhishek Bachchan', 'Aishwarya Rai Bachchan', 'Govinda', 'Vikram', 'Ajay Gehi', 'Ravi Kishan', 'Priyamani', 'Nikhil Dwivedi', 'Ganesh Acharya', 'Ashraf Ul Haq']",[],"A bandit leader kidnaps the wife of the policeman who killed his sister, but later falls in love with her.",Formato min incorrecto
tt1335992,Fast Lane,Movie,Drama,2014,1.0,NO DATA,"['tt1335992', 'Melina Lizette', 'Kenyetta Lethridge', 'Steven Bauer', 'Olivia Brown', 'Sevier Crespo', 'Anthony Ray Parker', 'Elika Crespo', 'Sara Sanderson', 'Ruben Palacios', 'Mary Christina Brown']",[],"A high-speed accident on the freeways of Los Angeles reveals a turf war between two competing car-theft rings of sexy all-girl crews. Streetwise young cop Brandy Martinezis assigned by lieutenant Baynes (Steven Bauer) to go undercover and infiltrate one of the crews. When Brandy falls for Carlo, an undercover cop also investigating the gangs, the two find themselves i... Leer todo",Formato min incorrecto
tt1336619,The Wylds,Movie,Drama,2010,8.0,NO DATA,"['tt1336619', 'Solomon Ray', 'Staci Crowe', 'Robert Bear', 'Larry Laverty', 'Elizabeth Mouton', 'Lillith Fields', 'Crystal Lewis', 'Robert Milo Andrus', 'Judah Justine', 'Erik Denton']",[],"A young runaway lives with a group of misfits in a junkyard, stealing to survive. When a traveling preacher tells him that his father is alive and wants him to come home, Chris must leave his family of thieves and venture into the wilderness in search of his father and a better life. Join Chris on an action-packed adventure as he outwits bandits, escapes swamp monster... Leer todo",Formato min incorrecto
tt1336617,Cyrus,Movie,Drama,2010,7.0,NO DATA,"['tt1336617', 'John C. Reilly', 'Marisa Tomei', 'Jonah Hill', 'Catherine Keener', 'Matt Walsh', 'Diane Mizota', 'Kathy Wittes', 'Katie Aselton', 'Jamie Donnelly', 'Tim Guinee']",[],"Con la vida social de John paralizada y su ex-esposa a punto de volverse a casar, este desafortunado divorciado finalmente conoce a la mujer de sus sueños, sólo para descubrir que hay otro hombre en su vida: su hijo.",Formato min incorrecto
tt1337366,Nokas,Movie,Drama,2010,10.0,NO DATA,"['tt1337366', 'Marit Synnøve Berg', 'Frode Winther', 'Morten Larsen', 'Tov Sletta', 'Hege Kristin Kjærvoll Sunde', 'Thomas Berhane', 'André Eriksen', 'Francis Gamble', 'Morten Håland', 'Geir Høiseth']",[],"The movie portrays Norway's most spectacular robbery, where 11 men occupied central Stavanger for twenty minutes and escaped with 57 million kroner (appx $10 million). A police officer was shot and killed.",NO DATA
tt1337350,Les mains libres,Movie,Drama,2010,6.0,NO DATA,"['tt1337350', 'Ronit Elkabetz', 'Carlo Brandt', 'Noémie Lvovsky', 'Camille Figuereo', 'Adama Doumbia', 'Denis Maréchal', 'Gurgon Kyap', 'Abdelhafid Metalsi', 'Xavier Legrand', ""Ahmed M'Hemdi""]",[],"Barbara is a filmmaker who has been working in the prison environment for a few years now. She is preparing a film written and directed by long-term inmates in a prison in the projects around Paris. Twice a week, Barbara goes to the prison where she shoots interviews with the inmates which will serve as a basis for the writing of their screenplay. But Barbara has enco... Leer todo",100
tt1336998,Hunting & Zn.,Movie,Drama,2010,2.0,NO DATA,"['tt1336998', 'Dragan Bakema', 'Hans Hoes', 'Noël Keulen', 'Maria Kraakman', 'Rick Nicolet', 'Celia Nufaar', 'Mirjam Stolwijk']",[],The impact of pregnancy on a happy young couple.,93
tt1337103,The Erotic Man,Movie,Drama,2010,11.0,NO DATA,"['tt1337103', 'Angeli Bayani', 'Sue Prado', 'Jørgen Leth', 'Ana Flavia Cavalcanti', 'Paula Jubé', 'Chaisiellen Anne da Silva Oliviera', 'Gal Quaresma', 'Helena Cerello', 'Rokhaya Niang', 'Sarah Gaugler']",[],"A collections of scenes based on documents, letters, pictures and poems that depict a man's erotic nature.",85
tt1337673,Nodame Kantâbire: Saishuu-gakushou - Kouhen,Movie,Drama,2010,4.0,NO DATA,"['tt1337673', 'Juri Ueno', 'Hiroshi Tamaki', 'Eita Nagayama', 'Asami Mizukawa', 'Keisuke Koide', 'Eiji Wentz', 'Becky', 'Yû Yamada', 'Takeshi Nadagi', 'Tsubaki Nekoze']",[],"Nodame (Juri Ueno) is still pining for the affections of Chiaki (Hiroshi Tamaki), but Chiaki wants them to concentrate on their musical careers and moves out. Chiaki then gets the opportunity to perform with Song Rui (Yu Yamada) and the Wiltord Orchestra of Vienna. Meanwhile, Nodame remains at the conservatory in Paris, but Professor AuClair refuses to let her compete... Leer todo",123
tt1339161,Der Räuber,Movie,Drama,2010,2.0,NO DATA,"['tt1339161', 'Andreas Lust', 'Markus Schleinzer', 'Roman Kettner', 'Hannelore Klauber-Laursen', 'Tabea Werich', 'Nina Steiner', 'Josef Romestorffer', 'Franziska Weisz', 'Wolfgang Petrik', 'Florian Wotruba']",[],"A story based on Johann Rettenberger, an Austrian marathon runner and a bank robber.",NO DATA
tt1339488,Raspberry Magic,Movie,Drama,2010,7.0,NO DATA,"['tt1339488', 'Lily Javaherpour', 'Meera Simhan', 'Ravi Kapoor', 'Keya Shah', 'Bella Thorne', 'Colter Allison', 'Randall Batinkoff', 'Alison Brie', 'Eric Scott Cooper', 'Kellie Daniel']",[],"A little girl attempts an innovative experiment on raspberry plants for her school science fair, alongside the troubles of her dysfunctional home life and her depressed mother.",Formato min incorrecto
tt1339500,The Shot Felt 'Round the World,Movie,Drama,2010,,NO DATA,"['tt1339500', 'Jonas Salk', 'Peter Salk', 'Jonathan Salk', 'David Oshinsky', 'Julius S. Younger', 'John Troan', 'Ethel J. Bailey', 'Raymond White', 'Donald Wegemer', 'Jeanne Beaumont Winner']",[],"The images and memories are still familiar to those of a certain age - children in braces or iron lungs; the terrifying fear that washed over America each summer - a fear that out of nowhere a seemingly healthy child would catch polio and be crippled or killed. A fear so great that children were forbidden to play at pools, playgrounds and movie theaters. And, then, a ... Leer todo",67
tt1340107,Hævnen,Movie,Drama,2011,4.0,NO DATA,"['tt1340107', 'Mikael Persbrandt', 'Trine Dyrholm', 'Markus Rygaard', 'Wil Johnson', 'Eddy Kimani', 'Emily Mulaya', 'Gabriel Muli', 'June Waweru', 'Mary Ndoku Mbai', 'Dynah Bereket']",[],"Las vidas de dos familias danesas se entrecruzan y una extraordinaria pero arriesgada amistad surge. Soledad, fragilidad y dolor están a la vuelta de la esquina.",NO DATA
tt13400338,Tabahi,Movie,Drama,2010,,NO DATA,"['tt13400338', 'Amir Aghaee', 'Mehran Ahmadi', 'Masoumeh Bafandeh', 'Sareh Bayat', 'Shahrokh Foroutanian', 'Parastoo Moghaddam', 'Masoud Sakhaei', 'Seyyed Ali Salehi', 'Siros Taghinezhad', 'Shahin Taslimi']",[],,NO DATA
tt1340119,Russian Snark,Movie,Drama,2010,7.0,NO DATA,"['tt1340119', 'Stephen Papps', 'Elena Stejko', 'Paul Glover', 'Mark Huston', 'Greg Johnson', 'Te Waimarie Kessell', 'Ryan Lamp', 'Rene Naufahu', 'Peter Rowley', 'Mahdu Shashea']",[],"A Russian immigrant is obsessed with his experimental film-making forcing his wife to take a job as a stripper to cover their financial needs. A Polynesian woman draws him from his self-destructive bent, allowing him to reconnect.",79
tt1340793,The Rock 'n' Roll Dreams of Duncan Christopher,Movie,Drama,2012,5.0,NO DATA,"['tt1340793', 'Jack Roberts', 'Peter Bedgood', 'Marshall Bell', 'Lizz Carter', 'Heather Roberts', 'Aaron Moreland', 'Justin S. Monroe', 'Meaghan Oppenheimer', 'Riley Spyres', 'Lucas Mackay Smith']",[],"The awkward son of a rock legend, Duncan Christopher, works through the suicide of his father in the brutal underground world of karaoke.",79
tt1340773,Elektra Luxx,Movie,Drama,2010,3.0,NO DATA,"['tt1340773', 'Joseph Gordon-Levitt', 'Carla Gugino', 'Ermahn Ospina', 'Jake Hames', 'Patrick Caberty', 'Kathleen Quinlan', 'Melissa Stephens', 'Susie Goliti', 'Lucy Punch', 'Marley Shelton']",[],La vida de la actriz porno Elektra Luxx se pone patas arriba al descubrir que está embarazada.,79
tt1340834,Köntörfalak,Movie,Drama,2010,2.0,NO DATA,"['tt1340834', 'Ferenc Elek', 'Kátya Tompos', 'Roland Rába', 'Tamara Zsigmond', 'Szilárd Wass', 'Marcell Váczy', 'Maxim Váczy', 'Zoltán Belényi', 'Sarolta Bodó', 'Samu Benke']",[],Two perfect strangers. A blind date. An urban legend.,81
tt1341167,Four Lions,Movie,Drama,2010,9.0,NO DATA,"['tt1341167', 'Will Adamsdale', 'Riz Ahmed', 'Adeel Akhtar', 'Kayvan Novak', 'Nigel Lindsay', 'Preeya Kalidas', 'Mohamad Akil', 'Craig Parkinson', 'Karl Seth', 'Waleed Elgadi']",[],Cuatro terroristas británicos incompetentes se disponen a entrenar y cometer un acto terrorista.,81
tt1341188,How Do You Know,Movie,Drama,2011,2.0,NO DATA,"['tt1341188', 'Reese Witherspoon', 'Paul Rudd', 'Owen Wilson', 'Jack Nicholson', 'Kathryn Hahn', 'Mark Linn-Baker', 'Lenny Venito', 'Molly Price', 'Ron McLarty', 'Shelley Conn']",[],"Tras ser excluida del equipo de sóftbol de Estados Unidos, Lisa se encuentra valorando su vida y en medio de un triángulo amoroso, mientras un hombre de negocios en crisis compite con su actual novio jugador de béisbol.",NO DATA
tt1342120,Polish Bar,Movie,Drama,2010,10.0,NO DATA,"['tt1342120', 'James Badge Dale', 'Judd Hirsch', 'Richard Belzer', 'Meat Loaf', 'Golden Brooks', 'Maestro Harrell', 'Vincent Piazza', 'Dov Tiefenbach', 'Joe Minoso', 'Matthew Gold']",[],"In this story of faith, loyalty and family, Reuben is a young, middle-class Jew who is fed up with the family jewelry business. He looks for respect by trying to prove himself as a Hip Hop DJ and working for Polish criminals at the local strip club.",Formato min incorrecto
tt1342122,Queen of the Lot,Movie,Drama,2010,11.0,NO DATA,"['tt1342122', 'Tanna Frederick', 'Noah Wyle', 'Christopher Rydell', 'David Proval', 'Zack Norman', 'Paul Sand', 'Peter Bogdanovich', 'Dennis Christopher', 'Jack Heller', 'Kathryn Grant']",[],"An electronic ankle bracelet and being under house arrest aren't about to stop up-and-coming actress Maggie Chase (Tanna Frederick) from the two things she craves the most: real fame and true love. With more ""Google points"" than her Iowa hometown, but far less than Angelina Jolie, Maggie is desperate to claw her way off the B-list of action/adventure pictures and into... Leer todo",Formato min incorrecto
tt1343703,Brestskaya krepost,Movie,Drama,2010,11.0,NO DATA,"['tt1343703', 'Aleksey Kopashov', 'Andrey Merzlikin', 'Pavel Derevyanko', 'Aleksandr Korshunov', 'Maksim Kostromykin', 'Anna Tsukanova-Kott', 'Sergey Tsepov', 'Benik Arakelyan', 'Mikhail Pavlik', 'Sergey Vlasov']",[],"A war drama set during the Nazi invasion of the Soviet Union in June 1941, in which Soviet troops held on to a border stronghold for nine days.",NO DATA
tt1343704,Zeiten ändern Dich,Movie,Drama,2010,2.0,NO DATA,"['tt1343704', 'Bushido', 'Moritz Bleibtreu', 'Reza Brojerdi', 'Karoline Schuch', ""Elyas M'Barek"", 'Hannelore Elsner', 'Katja Flint', 'Uwe Ochsenknecht', 'Mina Tander', 'Karel Gott']",[],"The life story of German gangsta rapper, Bushido.",94
tt13439140,En Ullam Unnai Theduthe,Movie,Drama,2010,1.0,NO DATA,"['tt13439140', 'Anandraj', 'Vaiyapuri', 'Manjula Vijayakumar']",[],,111
tt13439706,Aarvam,Movie,Drama,2010,10.0,NO DATA,"['tt13439706', 'Saleel Hussain', ""'Ganja' Karuppu"", 'Scissor Manohar', 'Ponnambalam']",[],"Anjali (Meenu Karthika), the sister of the dreaded gangster Aadhi (Karate Raja), leaves the city and returns to her hometown after finishing her studies. The young man Mahesh (R. Sanjay), the son of a revenue inspector, falls at first sight with Anjali during the village's festival. Mahesh then proposes his love to her but she refuses to love a person that she doesn't... Leer todo",140
tt13439740,Thangapaambu,Movie,Drama,2010,,NO DATA,"['tt13439740', 'Karthikeyan', 'Srirekha', 'Vayola']",[],,NO DATA
tt13439936,Ragasiyam,Movie,Drama,2010,9.0,NO DATA,['tt13439936'],[],,NO DATA
tt13440020,Unakkaga En Kadhal,Movie,Drama,2010,8.0,NO DATA,"['tt13440020', 'Delhi Ganesh', 'Munnar Ramesh', 'Soori']",[],"In a village, Seetha (Shraddha) hails from a middle-class Brahmin family. She lives with her parents Seenu (Delhi Ganesh) and Mangalam (Rajyalakshmi), aunt (Anjali Devi), and cousin Ramu (Vishnupriyan). Ramu is a jobless and naive young man who is madly in love with Seetha since childhood. Seenu promised Ramu that he will marry Seetha. Seetha then gets admission in a ... Leer todo",130
tt13439648,Sanikizhamai Saayangalam 5 Mani,Movie,Drama,2010,12.0,NO DATA,"['tt13439648', 'Ravi Bharathi', 'Meera Krishnan', 'Malini', 'Sarath']",[],,135
